{
  "schema_version": "1.0.0",
  "source_type": "gmail",
  "source_label": "Recruiter scheduling email",
  "observed_at": "2026-08-30T18:00:00-04:00",
  "event_type": "human_outreach",
  "sender_type": "human",
  "company": "Acme Lock & Door",
  "role": "Access Control Technician",
  "subject": "Invitation to schedule prescreen interview",
  "body": "Hi David, are you still interested in the Access Control Technician role? Please use the scheduling link below to schedule your prescreen.",
  "contact_name": "Jordan",
  "requires_response": true,
  "scheduling_link": "https://example.com/calendly",
  "currentness": "current",
  "status": "active",
  "contact_history_state": "contacted"
}
